{
  "evidence_id": "s02e02-white-bear-bystander-phone-recording-norm-ev1",
  "thesis_id": "s02e02-white-bear-bystander-phone-recording-norm",
  "url": "https://en.wikipedia.org/wiki/White_Bear_(Black_Mirror)",
  "title": "White Bear",
  "accessed_at": "2026-07-09",
  "tier": "L1",
  "supports_axes": [
    "THESIS_POSS",
    "AI_EXEC",
    "FID"
  ],
  "excerpt": "Onlookers silently record the protagonist.",
  "notes": ""
}
