{
  "evidence_id": "s01e01-national-anthem-partial-real-world-analogue-ev1",
  "thesis_id": "s01e01-national-anthem-partial-real-world-analogue",
  "url": "https://www.investigatetv.com/2026/04/10/investigatetv-deepfake-videos-politicians-possible-consequences-future-elections/",
  "title": "InvestigateTV+ deepfake politicians 2026",
  "accessed_at": "2026-07-09",
  "tier": "L2",
  "supports_axes": [
    "THESIS_POSS",
    "AI_EXEC",
    "FID"
  ],
  "excerpt": "Experts warn deepfake videos of politicians could have dire consequences for elections.",
  "notes": ""
}
