{
  "evidence_id": "s03e04-san-junipero-consciousness-upload-afterlife-ev1",
  "thesis_id": "s03e04-san-junipero-consciousness-upload-afterlife",
  "url": "https://theconversation.com/an-ai-afterlife-is-now-a-real-option-but-what-becomes-of-your-legal-status-274021",
  "title": "AI afterlife",
  "accessed_at": "2026-07-09",
  "tier": "L2",
  "supports_axes": [
    "THESIS_POSS",
    "AI_EXEC",
    "FID"
  ],
  "excerpt": "Digital twins/deathbots are simulations from data, not mind upload.",
  "notes": ""
}
