{
  "evidence_id": "s04e05-metalhead-partial-real-world-analogue-ev1",
  "thesis_id": "s04e05-metalhead-partial-real-world-analogue",
  "url": "https://en.wikipedia.org/wiki/Metalhead_(Black_Mirror)",
  "title": "Metalhead",
  "accessed_at": "2026-07-09",
  "tier": "L1",
  "supports_axes": [
    "THESIS_POSS",
    "AI_EXEC",
    "FID"
  ],
  "excerpt": "Robot dogs hunt survivors.",
  "notes": ""
}
