{
  "evidence_id": "s07e03-hotel-reverie-partial-real-world-analogue-ev1",
  "thesis_id": "s07e03-hotel-reverie-partial-real-world-analogue",
  "url": "https://www.netflix.com/tudum/articles/black-mirror-season-7",
  "title": "Hotel Reverie",
  "accessed_at": "2026-07-09",
  "tier": "L1",
  "supports_axes": [
    "THESIS_POSS",
    "AI_EXEC",
    "FID"
  ],
  "excerpt": "Immersive remake traps star in vintage film world.",
  "notes": ""
}
