{
  "evidence_id": "s02e01-be-right-back-griefbot-persona-from-data-ev1",
  "thesis_id": "s02e01-be-right-back-griefbot-persona-from-data",
  "url": "https://theconversation.com/an-ai-afterlife-is-now-a-real-option-but-what-becomes-of-your-legal-status-274021",
  "title": "AI afterlife Conversation 2026",
  "accessed_at": "2026-07-09",
  "tier": "L2",
  "supports_axes": [
    "THESIS_POSS",
    "AI_EXEC",
    "FID"
  ],
  "excerpt": "Griefbots and digital twins proliferate in digital afterlife industry.",
  "notes": ""
}
